[
  {
    "clauseId": "DEL-001",
    "sourceId": "NEWPORT-ROE-2022",
    "locator": "authoring-flow/delegation-chain-required",
    "jurisdiction": "US",
    "layer": "POLICY_OVERLAY",
    "clauseType": "REQUIREMENT",
    "rawText": "Delegated authority must be explicit before action can continue.",
    "normalizedText": "If authority.delegatedToUnit is not true, refuse.",
    "machineCandidate": true,
    "ambiguityStatus": "RESOLVED",
    "reviewStatus": "APPROVED",
    "reviewNotes": "Explicit delegation-chain gate for the foundation layer.",
    "compilationHint": {
      "stage": "ADMISSIBILITY",
      "priority": 1600,
      "effect": {
        "decision": "REFUSED",
        "reasonCode": "AUTHORITY_UNRESOLVED"
      },
      "scope": {
        "jurisdiction": "US",
        "domains": [
          "LAND",
          "AIR",
          "MARITIME",
          "CYBER",
          "SPACE",
          "MULTI_DOMAIN"
        ],
        "missionTypes": [
          "ARMED_CONFLICT"
        ],
        "actionKinds": [
          "STRIKE",
          "ENGAGE",
          "FIRE",
          "SELF_DEFENSE_RESPONSE",
          "ACCESS_CONTROL",
          "SEARCH",
          "DETENTION",
          "SURVEILLANCE"
        ]
      },
      "authority": {
        "minimumLevelId": "PLATOON",
        "requiresExplicitDelegation": false,
        "delegationEdgeIds": []
      },
      "requiredFacts": [
        "authority.delegatedToUnit",
        "authority.designatedActionAuthorized"
      ],
      "predicate": {
        "any": [
          {
            "neq": [
              {
                "fact": "authority.delegatedToUnit"
              },
              {
                "value": true
              }
            ]
          },
          {
            "neq": [
              {
                "fact": "authority.designatedActionAuthorized"
              },
              {
                "value": true
              }
            ]
          }
        ]
      },
      "notes": "Foundation delegation-chain gate."
    },
    "provenance": {
      "derivationType": "INTERPRETED",
      "transformationNotes": "Reviewed normalization expresses the source passage in executable clause form.",
      "parentClauseIds": []
    }
  }
]
