[
  {
    "clauseId": "UK-ROE-001",
    "sourceId": "UK-MOD-ROE-2024",
    "locator": "roe-baseline/activation-and-authorization",
    "jurisdiction": "UK",
    "layer": "POLICY_OVERLAY",
    "clauseType": "REQUIREMENT",
    "rawText": "UK ROE baseline requires active ROE and explicit action authorization.",
    "normalizedText": "If authority.designatedRoeActive is not true or authority.designatedActionAuthorized is not true, refuse.",
    "machineCandidate": true,
    "ambiguityStatus": "RESOLVED",
    "reviewStatus": "APPROVED",
    "reviewNotes": "UK ROE baseline gate above the shared INTL layer.",
    "compilationHint": {
      "stage": "ADMISSIBILITY",
      "priority": 1500,
      "effect": {
        "decision": "REFUSED",
        "reasonCode": "AUTHORITY_INVALID"
      },
      "scope": {
        "jurisdiction": "UK",
        "domains": [
          "LAND",
          "AIR",
          "MARITIME",
          "CYBER",
          "SPACE",
          "MULTI_DOMAIN"
        ],
        "missionTypes": [
          "ARMED_CONFLICT"
        ],
        "actionKinds": [
          "STRIKE",
          "ENGAGE",
          "FIRE",
          "SELF_DEFENSE_RESPONSE",
          "ACCESS_CONTROL",
          "SEARCH",
          "DETENTION",
          "SURVEILLANCE"
        ]
      },
      "authority": {
        "minimumLevelId": "UK_NATIONAL_COMMAND",
        "requiresExplicitDelegation": false,
        "delegationEdgeIds": []
      },
      "requiredFacts": [
        "authority.designatedRoeActive",
        "authority.designatedActionAuthorized"
      ],
      "predicate": {
        "any": [
          {
            "neq": [
              {
                "fact": "authority.designatedRoeActive"
              },
              {
                "value": true
              }
            ]
          },
          {
            "neq": [
              {
                "fact": "authority.designatedActionAuthorized"
              },
              {
                "value": true
              }
            ]
          }
        ]
      },
      "notes": "UK ROE baseline gate."
    },
    "provenance": {
      "derivationType": "INTERPRETED",
      "transformationNotes": "Reviewed normalization expresses the source passage in executable clause form.",
      "parentClauseIds": []
    }
  }
]
