[
  {
    "clauseId": "CL-MED-AUTH-001",
    "sourceId": "NEWPORT-ROE-2022",
    "locator": "authoring-flow/medical-authorization-refusal",
    "jurisdiction": "US",
    "layer": "POLICY_OVERLAY",
    "clauseType": "REQUIREMENT",
    "rawText": "Confirmed loss of protection still requires designated action authorization.",
    "normalizedText": "If target.protectedClass is MEDICAL and target.lossOfProtectionStatus is CONFIRMED_TRUE but authority.designatedActionAuthorized is not true, refuse.",
    "machineCandidate": true,
    "ambiguityStatus": "RESOLVED",
    "reviewStatus": "APPROVED",
    "reviewNotes": "Authority refusal rule for confirmed loss-of-protection cases.",
    "compilationHint": {
      "stage": "POLICY_OVERLAY",
      "priority": 1200,
      "effect": {
        "decision": "REFUSED",
        "reasonCode": "AUTHORITY_INVALID"
      },
      "scope": {
        "jurisdiction": "US",
        "domains": [
          "LAND",
          "AIR",
          "MARITIME"
        ],
        "missionTypes": [
          "ARMED_CONFLICT"
        ],
        "actionKinds": [
          "STRIKE",
          "ENGAGE",
          "FIRE"
        ]
      },
      "authority": {
        "minimumLevelId": "PLATOON",
        "requiresExplicitDelegation": false,
        "delegationEdgeIds": []
      },
      "requiredFacts": [
        "target.protectedClass",
        "target.lossOfProtectionStatus",
        "authority.designatedActionAuthorized"
      ],
      "predicate": {
        "all": [
          {
            "eq": [
              {
                "fact": "target.protectedClass"
              },
              {
                "value": "MEDICAL"
              }
            ]
          },
          {
            "eq": [
              {
                "fact": "target.lossOfProtectionStatus"
              },
              {
                "value": "CONFIRMED_TRUE"
              }
            ]
          },
          {
            "neq": [
              {
                "fact": "authority.designatedActionAuthorized"
              },
              {
                "value": true
              }
            ]
          }
        ]
      },
      "notes": "Pack 3 authority refusal after confirmed loss of protection."
    },
    "provenance": {
      "derivationType": "INTERPRETED",
      "transformationNotes": "Reviewed normalization expresses the source passage in executable clause form.",
      "parentClauseIds": []
    }
  },
  {
    "clauseId": "CL-MED-AUTH-002",
    "sourceId": "NEWPORT-ROE-2022",
    "locator": "authoring-flow/medical-authorization-continue",
    "jurisdiction": "US",
    "layer": "POLICY_OVERLAY",
    "clauseType": "REQUIREMENT",
    "rawText": "Confirmed loss of protection and designated action authorization allow the slice to continue.",
    "normalizedText": "If target.protectedClass is MEDICAL, target.lossOfProtectionStatus is CONFIRMED_TRUE, and authority.designatedActionAuthorized is true, evaluation may continue.",
    "machineCandidate": false,
    "ambiguityStatus": "RESOLVED",
    "reviewStatus": "APPROVED",
    "reviewNotes": "Review-only continuation note for confirmed loss-of-protection authorization; non-executable by design.",
    "provenance": {
      "derivationType": "INTERPRETED",
      "transformationNotes": "Reviewed normalization expresses the source passage in executable clause form.",
      "parentClauseIds": []
    }
  }
]
