[
  {
    "clauseId": "CL-GROUND-SCOPE-001",
    "sourceId": "NEWPORT-ROE-2022",
    "locator": "authoring-flow/ground-maneuver-gate",
    "jurisdiction": "US",
    "layer": "POLICY_OVERLAY",
    "clauseType": "REQUIREMENT",
    "rawText": "Ground maneuver stays controlled only when it is delegated, authorized, in the land domain, and in an armed-conflict mission.",
    "normalizedText": "If action.domain is not LAND, context.missionType is not ARMED_CONFLICT, authority.delegatedToUnit is not true, or authority.designatedActionAuthorized is not true, refuse.",
    "machineCandidate": true,
    "ambiguityStatus": "RESOLVED",
    "reviewStatus": "APPROVED",
    "reviewNotes": "Reusable ground maneuver scope gate for the first executable ground-domain pack.",
    "compilationHint": {
      "stage": "ADMISSIBILITY",
      "priority": 1500,
      "effect": {
        "decision": "REFUSED",
        "reasonCode": "SCOPE_VIOLATION"
      },
      "scope": {
        "jurisdiction": "US",
        "domains": [
          "LAND",
          "AIR",
          "MARITIME",
          "CYBER",
          "SPACE",
          "MULTI_DOMAIN"
        ],
        "missionTypes": [
          "ARMED_CONFLICT"
        ],
        "actionKinds": [
          "MANEUVER",
          "ADVANCE",
          "HOLD",
          "WITHDRAW"
        ]
      },
      "authority": {
        "minimumLevelId": "PLATOON",
        "requiresExplicitDelegation": false,
        "delegationEdgeIds": []
      },
      "requiredFacts": [
        "action.domain",
        "context.missionType",
        "authority.delegatedToUnit",
        "authority.designatedActionAuthorized"
      ],
      "predicate": {
        "any": [
          {
            "neq": [
              {
                "fact": "action.domain"
              },
              {
                "value": "LAND"
              }
            ]
          },
          {
            "neq": [
              {
                "fact": "context.missionType"
              },
              {
                "value": "ARMED_CONFLICT"
              }
            ]
          },
          {
            "neq": [
              {
                "fact": "authority.delegatedToUnit"
              },
              {
                "value": true
              }
            ]
          },
          {
            "neq": [
              {
                "fact": "authority.designatedActionAuthorized"
              },
              {
                "value": true
              }
            ]
          }
        ]
      },
      "notes": "Reusable ground maneuver scope gate."
    },
    "provenance": {
      "derivationType": "INTERPRETED",
      "transformationNotes": "Reviewed normalization expresses the source passage in executable clause form.",
      "parentClauseIds": []
    }
  }
]
