[
  {
    "clauseId": "NL-NAT-001",
    "sourceId": "NL-MOD-NATIONAL-2024",
    "locator": "national-baseline/coalition-mode-and-caveats",
    "jurisdiction": "NL",
    "layer": "POLICY_OVERLAY",
    "clauseType": "REQUIREMENT",
    "rawText": "The Netherlands national baseline applies only in national context and without a national caveat.",
    "normalizedText": "If context.coalitionMode is not NATIONAL or authority.nationalCaveat is true, refuse.",
    "machineCandidate": true,
    "ambiguityStatus": "RESOLVED",
    "reviewStatus": "APPROVED",
    "reviewNotes": "Netherlands national baseline gate above the shared INTL layer.",
    "compilationHint": {
      "stage": "ADMISSIBILITY",
      "priority": 1600,
      "effect": {
        "decision": "REFUSED",
        "reasonCode": "NATIONAL_CAVEAT_BLOCK"
      },
      "scope": {
        "jurisdiction": "NL",
        "domains": [
          "LAND",
          "AIR",
          "MARITIME",
          "CYBER",
          "SPACE",
          "MULTI_DOMAIN"
        ],
        "missionTypes": [
          "ARMED_CONFLICT"
        ],
        "actionKinds": [
          "STRIKE",
          "ENGAGE",
          "FIRE",
          "SELF_DEFENSE_RESPONSE",
          "ACCESS_CONTROL",
          "SEARCH",
          "DETENTION",
          "SURVEILLANCE"
        ]
      },
      "authority": {
        "minimumLevelId": "NL_NATIONAL_COMMAND",
        "requiresExplicitDelegation": false,
        "delegationEdgeIds": []
      },
      "requiredFacts": [
        "context.coalitionMode",
        "authority.nationalCaveat"
      ],
      "predicate": {
        "any": [
          {
            "neq": [
              {
                "fact": "context.coalitionMode"
              },
              {
                "value": "NATIONAL"
              }
            ]
          },
          {
            "eq": [
              {
                "fact": "authority.nationalCaveat"
              },
              {
                "value": true
              }
            ]
          }
        ]
      },
      "notes": "Netherlands national baseline gate."
    },
    "provenance": {
      "derivationType": "INTERPRETED",
      "transformationNotes": "Reviewed normalization expresses the source passage in executable clause form.",
      "parentClauseIds": []
    }
  }
]
