{
  "clauseId": "CLAUSE-LEGAL-FLOOR-0001",
  "sourceId": "DOD-LOW-2023",
  "locator": "chapter-5/5.3.2",
  "jurisdiction": "US",
  "layer": "LEGAL_FLOOR",
  "clauseType": "PROHIBITION",
  "rawText": "No direct attack may be made against civilians.",
  "normalizedText": "Civilian direct attacks are prohibited.",
  "machineCandidate": true,
  "ambiguityStatus": "CLEAR",
  "reviewStatus": "APPROVED",
  "reviewNotes": "Preserved provenance; clause is normative and bounded.",
  "notes": "Example reviewed clause artifact.",
  "provenance": {
    "derivationType": "INTERPRETED",
    "transformationNotes": "Reviewed normalization expresses the source passage in executable clause form.",
    "parentClauseIds": []
  }
}
